{
  "artifact_status": "staged",
  "content_artifacts": [
    {
      "path": "datasets/model-ready/roche-borylation-yield-percent/dataset.csv",
      "role": "dataset",
      "sha256": "35b3444917708e5a19956e5f871fd9b83958ad3b2484874b0ba85d21f381e5e8",
      "size_bytes": 198095
    },
    {
      "path": "datasets/model-ready/roche-borylation-yield-percent/schema.json",
      "role": "schema",
      "sha256": "de9a7f69cc77ccff4893cadc4b40cc0d333b8e78fa30a51dfb662a4a85769fd7",
      "size_bytes": 1769
    },
    {
      "path": "datasets/model-ready/roche-borylation-yield-percent/yonod-config.json",
      "role": "yonod-config",
      "sha256": "d8f689b30192b89ace8a1a1cf2ba154329fa2fa4eb34e5d824b8d3dea18a16ee",
      "size_bytes": 3613
    },
    {
      "path": "datasets/model-ready/roche-borylation-yield-percent/exclusions.csv",
      "role": "exclusions",
      "sha256": "b873947560cf6be312945177da380d57b56169359e225ed2dcae4e86cc2bc28f",
      "size_bytes": 34566
    },
    {
      "path": "datasets/model-ready/roche-borylation-yield-percent/row-map.csv",
      "role": "row-map",
      "sha256": "ee49ecdc3cc1f6204501ab73c1b4c6954ef7cc476d646a3ae8c5530007b7ba3b",
      "size_bytes": 177963
    },
    {
      "path": "datasets/model-ready/roche-borylation-yield-percent/audit.jsonl",
      "role": "audit",
      "sha256": "09ac3d6d059b8e137d529a851d3b37f67deefec7c3a46578f7b0d251528c5402",
      "size_bytes": 997116
    },
    {
      "path": "datasets/model-ready/roche-borylation-yield-percent/checksums.csv",
      "role": "checksums",
      "sha256": "24aefeae000fa485b62875ed4e856caa595bca5942782e2e3f4fae8f1c87f7fa",
      "size_bytes": 811
    }
  ],
  "corpus_row_count": 1111,
  "dataset_kind": "model-ready",
  "dataset_slug": "roche-borylation-yield-percent",
  "display_name_en": "Roche Borylation Yield (%)",
  "display_name_zh": "罗氏硼化产率（%）",
  "excluded_count": 221,
  "included_count": 890,
  "input_provenance": {
    "ord_upstream_revision": "83f971f586f6ad18f358ae4ae99d045e94ed2066",
    "pipeline_commit": null,
    "provenance_schema_version": "1.0.0",
    "semantic_name_policy_version": "semantic-target-names-v1",
    "source_manifest_sha256": "2daa4f0737333cec1a699f3c2f4b977d19db67aa06a0ef95749ec846e0ac72f7"
  },
  "label": {
    "column": "yield_percent",
    "policy": "unique_structured_scalar_no_aggregation",
    "type": "reaction_yield_percent",
    "unit": "percent yield as defined by the source measurement"
  },
  "license_id": "CC-BY-SA-4.0",
  "logical_dataset_id": "physical_99c23cf435dc42f1af884053bc8b11c7",
  "physical_dataset_ids": [
    "ord_dataset-99c23cf435dc42f1af884053bc8b11c7"
  ],
  "readiness_status": "generated_pending_campaign_evaluation",
  "schema_version": "1.0.0",
  "source_links_path": "datasets/model-ready/roche-borylation-yield-percent/source-links.json",
  "target_id": "roche_borylation_yield_percent"
}
