{
  "artifact_status": "staged",
  "content_artifacts": [
    {
      "path": "datasets/model-ready/chemrxiv-aniline-amidation-yield-percent/chemrxiv-aniline-amidation-yield-percent-dataset.csv",
      "role": "dataset",
      "sha256": "90c762cff7defe31e7e45d35406df595d094186a0b35b05b0f799cfe66411f72",
      "size_bytes": 238260
    },
    {
      "path": "datasets/model-ready/chemrxiv-aniline-amidation-yield-percent/schema.json",
      "role": "schema",
      "sha256": "3df9ea65934570a4012966c9eb5bca742ea943bbcdf9fdc743e6b6e306b5af9e",
      "size_bytes": 1783
    },
    {
      "path": "datasets/model-ready/chemrxiv-aniline-amidation-yield-percent/yonod-config.json",
      "role": "yonod-config",
      "sha256": "6db195daa13f29476cd44ae176ed1a27bfb5d2fd6a1bb43d0d4257b4f6af967b",
      "size_bytes": 3463
    },
    {
      "path": "datasets/model-ready/chemrxiv-aniline-amidation-yield-percent/exclusions.csv",
      "role": "exclusions",
      "sha256": "2cf41e5f67c8f2932bd6acc9c33170f90a492213d26117ef9acb515c2e72528d",
      "size_bytes": 538
    },
    {
      "path": "datasets/model-ready/chemrxiv-aniline-amidation-yield-percent/row-map.csv",
      "role": "row-map",
      "sha256": "be63107c0184d74c9f9a7ce94a96c4c7aafa3ee21e3ec37c9f73a10e6343a38b",
      "size_bytes": 191267
    },
    {
      "path": "datasets/model-ready/chemrxiv-aniline-amidation-yield-percent/audit.jsonl",
      "role": "audit",
      "sha256": "57db77438a16ba93c2d71c026c82d35eff6e843221a071b3e7731b442a7fc04b",
      "size_bytes": 962270
    },
    {
      "path": "datasets/model-ready/chemrxiv-aniline-amidation-yield-percent/checksums.csv",
      "role": "checksums",
      "sha256": "ad6a338a326d0e2f2f5fba47903710dd429fd6566a1f648401c05b61289f0e3b",
      "size_bytes": 850
    }
  ],
  "corpus_row_count": 2496,
  "dataset_kind": "model-ready",
  "dataset_slug": "chemrxiv-aniline-amidation-yield-percent",
  "display_name_en": "ChemRxiv Aniline-Amidation Yield (%)",
  "display_name_zh": "ChemRxiv 苯胺酰胺化产率（%）",
  "excluded_count": 3,
  "included_count": 957,
  "input_provenance": {
    "ord_upstream_revision": "83f971f586f6ad18f358ae4ae99d045e94ed2066",
    "pipeline_commit": null,
    "provenance_schema_version": "1.0.0",
    "semantic_name_policy_version": "semantic-target-names-v1",
    "source_manifest_sha256": "2daa4f0737333cec1a699f3c2f4b977d19db67aa06a0ef95749ec846e0ac72f7"
  },
  "label": {
    "column": "yield_percent",
    "policy": "unique_structured_scalar_no_aggregation",
    "type": "reaction_yield_percent",
    "unit": "percent yield as defined by the source measurement"
  },
  "license_id": "CC-BY-SA-4.0",
  "logical_dataset_id": "upstream_chemrxiv_64c7e2e1658ec5f7e5808425",
  "physical_dataset_ids": [
    "ord_dataset-7acd6ad2bf4d4cff841cad008ab726d5"
  ],
  "readiness_status": "active_generated_pending_release_validation",
  "schema_version": "1.0.0",
  "source_links_path": "datasets/model-ready/chemrxiv-aniline-amidation-yield-percent/source-links.json",
  "target_id": "chemrxiv_amide_yield_percent"
}
