{
  "artifact_status": "staged",
  "content_artifacts": [
    {
      "path": "datasets/model-ready/nano-c-n-photochemistry-yield-percent/nano-c-n-photochemistry-yield-percent-dataset.csv",
      "role": "dataset",
      "sha256": "21b8072d3587bc8b1290124dafa6fdcdceee501980b6e6a3769aee6ead804d6d",
      "size_bytes": 370116
    },
    {
      "path": "datasets/model-ready/nano-c-n-photochemistry-yield-percent/schema.json",
      "role": "schema",
      "sha256": "07e38d3719447d57e1f3dfb37b5cb0098baa29efd357009f70a5323e86de7087",
      "size_bytes": 1825
    },
    {
      "path": "datasets/model-ready/nano-c-n-photochemistry-yield-percent/exclusions.csv",
      "role": "exclusions",
      "sha256": "4db87054e05506fd5de5d774c6c8838094902ffa774d224d92780299eeee63a7",
      "size_bytes": 85
    },
    {
      "path": "datasets/model-ready/nano-c-n-photochemistry-yield-percent/row-map.csv",
      "role": "row-map",
      "sha256": "ffedd123fdc03215c748d8a18d3d86bbc4184b2b9ff44d2b968cc387fb5423d0",
      "size_bytes": 346925
    },
    {
      "path": "datasets/model-ready/nano-c-n-photochemistry-yield-percent/audit.jsonl",
      "role": "audit",
      "sha256": "f1068cc97bb89448b35c308d75ea7a382712ebb8f3eace4df2abf435b808a054",
      "size_bytes": 1665722
    },
    {
      "path": "datasets/model-ready/nano-c-n-photochemistry-yield-percent/checksums.csv",
      "role": "checksums",
      "sha256": "bedd00187729c1aa7e90337bf4135560bd255bc0e64bf32b8d47cccdb9aa90c1",
      "size_bytes": 746
    }
  ],
  "corpus_row_count": 1728,
  "dataset_kind": "model-ready",
  "dataset_slug": "nano-c-n-photochemistry-yield-percent",
  "display_name_en": "Nano C-N Photochemistry Yield (%)",
  "display_name_zh": "纳米 C-N 光化学产率（%）",
  "excluded_count": 0,
  "included_count": 1728,
  "input_provenance": {
    "ord_upstream_revision": "83f971f586f6ad18f358ae4ae99d045e94ed2066",
    "pipeline_commit": null,
    "provenance_schema_version": "1.0.0",
    "semantic_name_policy_version": "semantic-target-names-v1",
    "source_manifest_sha256": "2daa4f0737333cec1a699f3c2f4b977d19db67aa06a0ef95749ec846e0ac72f7"
  },
  "label": {
    "column": "yield_percent",
    "policy": "unique_structured_scalar_no_aggregation",
    "type": "reaction_yield_percent",
    "unit": "percent yield as defined by the source measurement"
  },
  "license_id": "CC-BY-SA-4.0",
  "logical_dataset_id": "physical_ac78456835404910b3a4c840248b6ac9",
  "physical_dataset_ids": [
    "ord_dataset-ac78456835404910b3a4c840248b6ac9"
  ],
  "readiness_status": "active_generated_pending_release_validation",
  "schema_version": "1.0.0",
  "source_links_path": "datasets/model-ready/nano-c-n-photochemistry-yield-percent/source-links.json",
  "target_id": "nano_yield_percent"
}
