{
  "artifact_status": "staged",
  "content_artifacts": [
    {
      "path": "datasets/model-ready/suzuki-miyaura-nanoscale-yield-percent/suzuki-miyaura-nanoscale-yield-percent-dataset.csv",
      "role": "dataset",
      "sha256": "75466f69ef7bcc53a3be76914166b91dd091c57471b62a4d69f5754f030c9f97",
      "size_bytes": 1706821
    },
    {
      "path": "datasets/model-ready/suzuki-miyaura-nanoscale-yield-percent/schema.json",
      "role": "schema",
      "sha256": "b7be306c738e568aa6e1009857737bf9dcc170ac016498e86afb12229a02ff4f",
      "size_bytes": 1979
    },
    {
      "path": "datasets/model-ready/suzuki-miyaura-nanoscale-yield-percent/yonod-config.json",
      "role": "yonod-config",
      "sha256": "6cde9da49886861767c7dd5526ec4bb61752c07bc1a4dbee955baa4262c1ebb2",
      "size_bytes": 4058
    },
    {
      "path": "datasets/model-ready/suzuki-miyaura-nanoscale-yield-percent/exclusions.csv",
      "role": "exclusions",
      "sha256": "4db87054e05506fd5de5d774c6c8838094902ffa774d224d92780299eeee63a7",
      "size_bytes": 85
    },
    {
      "path": "datasets/model-ready/suzuki-miyaura-nanoscale-yield-percent/row-map.csv",
      "role": "row-map",
      "sha256": "175f9d5922e70418d935aa0aea4113151005cefe12a8de714023a8397c224786",
      "size_bytes": 1161389
    },
    {
      "path": "datasets/model-ready/suzuki-miyaura-nanoscale-yield-percent/audit.jsonl",
      "role": "audit",
      "sha256": "d96060c7a5a7e8eee55a6b76dba11b5716f8f335c16bc68173aa5fc4da2f2b79",
      "size_bytes": 5575840
    },
    {
      "path": "datasets/model-ready/suzuki-miyaura-nanoscale-yield-percent/checksums.csv",
      "role": "checksums",
      "sha256": "64a2d6dd0855be5c02db75a75934e5f70ad7f8a58554b6d0fd1ebf202fbd3bcd",
      "size_bytes": 850
    }
  ],
  "corpus_row_count": 5760,
  "dataset_kind": "model-ready",
  "dataset_slug": "suzuki-miyaura-nanoscale-yield-percent",
  "display_name_en": "Suzuki-Miyaura Nanoscale Yield (%)",
  "display_name_zh": "Suzuki-Miyaura 纳米尺度产率（%）",
  "excluded_count": 0,
  "included_count": 5760,
  "input_provenance": {
    "ord_upstream_revision": "83f971f586f6ad18f358ae4ae99d045e94ed2066",
    "pipeline_commit": null,
    "provenance_schema_version": "1.0.0",
    "semantic_name_policy_version": "semantic-target-names-v1",
    "source_manifest_sha256": "2daa4f0737333cec1a699f3c2f4b977d19db67aa06a0ef95749ec846e0ac72f7"
  },
  "label": {
    "column": "yield_percent",
    "policy": "unique_structured_scalar_no_aggregation",
    "type": "reaction_yield_percent",
    "unit": "percent yield as defined by the source measurement"
  },
  "license_id": "CC-BY-SA-4.0",
  "logical_dataset_id": "physical_68cb8b4b2b384e3d85b5b1efae58b203",
  "physical_dataset_ids": [
    "ord_dataset-68cb8b4b2b384e3d85b5b1efae58b203"
  ],
  "readiness_status": "active_generated_pending_release_validation",
  "schema_version": "1.0.0",
  "source_links_path": "datasets/model-ready/suzuki-miyaura-nanoscale-yield-percent/source-links.json",
  "target_id": "suzuki_yield_percent"
}
