{
  "artifact_status": "staged",
  "content_artifacts": [
    {
      "path": "datasets/model-ready/flow-catechol-product-3-response-percent/flow-catechol-product-3-response-percent-dataset.csv",
      "role": "dataset",
      "sha256": "5cc90e232268be1fc5e15330039927b90a13a4444df2347987d312612ea771d2",
      "size_bytes": 218760
    },
    {
      "path": "datasets/model-ready/flow-catechol-product-3-response-percent/schema.json",
      "role": "schema",
      "sha256": "bc0d609c64485e8119ff6efb3030eb9511a4ed086fdb916f1bb054a0c4cdab96",
      "size_bytes": 1846
    },
    {
      "path": "datasets/model-ready/flow-catechol-product-3-response-percent/exclusions.csv",
      "role": "exclusions",
      "sha256": "4db87054e05506fd5de5d774c6c8838094902ffa774d224d92780299eeee63a7",
      "size_bytes": 85
    },
    {
      "path": "datasets/model-ready/flow-catechol-product-3-response-percent/row-map.csv",
      "role": "row-map",
      "sha256": "4089f9b99c44fc7bf8c06a5399a37378c28572da4f9f7bbb414bc51c56f21201",
      "size_bytes": 245723
    },
    {
      "path": "datasets/model-ready/flow-catechol-product-3-response-percent/audit.jsonl",
      "role": "audit",
      "sha256": "fb6280e62cda2401ae8d18ad2cd6ff984a973fe40e55ba97cd14e7134ad61a14",
      "size_bytes": 2600261
    },
    {
      "path": "datasets/model-ready/flow-catechol-product-3-response-percent/checksums.csv",
      "role": "checksums",
      "sha256": "082f24b450c30dfdc1be5f6945a347b508cc626d08c9d920c4a94563c99af736",
      "size_bytes": 749
    }
  ],
  "corpus_row_count": 1227,
  "dataset_kind": "model-ready",
  "dataset_slug": "flow-catechol-product-3-response-percent",
  "display_name_en": "Flow Catechol Product 3 HPLC Response (%)",
  "display_name_zh": "连续流儿茶酚产物 3 HPLC 响应（%）",
  "excluded_count": 0,
  "included_count": 1227,
  "input_provenance": {
    "ord_upstream_revision": "83f971f586f6ad18f358ae4ae99d045e94ed2066",
    "pipeline_commit": null,
    "provenance_schema_version": "1.0.0",
    "semantic_name_policy_version": "semantic-target-names-v1",
    "source_manifest_sha256": "2daa4f0737333cec1a699f3c2f4b977d19db67aa06a0ef95749ec846e0ac72f7"
  },
  "label": {
    "column": "product_3_yield_percent",
    "policy": "catechol_multitarget_v1:smiles_custom_name_hplc_yield",
    "type": "hplc_response_percent",
    "unit": "HPLC percentage response; not isolated yield"
  },
  "license_id": "CC-BY-SA-4.0",
  "logical_dataset_id": "physical_1ec2807f02fa4beda27d2a81b86eb843",
  "physical_dataset_ids": [
    "ord_dataset-1ec2807f02fa4beda27d2a81b86eb843"
  ],
  "readiness_status": "research_only_benchmark_blocked",
  "schema_version": "1.0.0",
  "source_links_path": "datasets/model-ready/flow-catechol-product-3-response-percent/source-links.json",
  "target_id": "catechol_product_3_yield_percent"
}
