{
  "artifact_status": "staged",
  "content_artifacts": [
    {
      "path": "datasets/model-ready/flow-catechol-product-2-response-percent/dataset.csv",
      "role": "dataset",
      "sha256": "d1a09d05fb70c93c221438761893f5f71f6390f94c49bef3973a42bcd9308c84",
      "size_bytes": 218696
    },
    {
      "path": "datasets/model-ready/flow-catechol-product-2-response-percent/schema.json",
      "role": "schema",
      "sha256": "58b5c8b23c33aa98fde3f26de8246df457cf8d45fa4bb1afe2536ca7079dc848",
      "size_bytes": 1846
    },
    {
      "path": "datasets/model-ready/flow-catechol-product-2-response-percent/yonod-config.json",
      "role": "yonod-config",
      "sha256": "c33097b32043c29bbd788b6323e6732b06d1ae232146d2fb8d79f40016be3e14",
      "size_bytes": 2268
    },
    {
      "path": "datasets/model-ready/flow-catechol-product-2-response-percent/exclusions.csv",
      "role": "exclusions",
      "sha256": "4db87054e05506fd5de5d774c6c8838094902ffa774d224d92780299eeee63a7",
      "size_bytes": 85
    },
    {
      "path": "datasets/model-ready/flow-catechol-product-2-response-percent/row-map.csv",
      "role": "row-map",
      "sha256": "16d61d8f56d8278be07a447031f8700ec6c5a2c02764c2f0191d86d3a76dc71f",
      "size_bytes": 245723
    },
    {
      "path": "datasets/model-ready/flow-catechol-product-2-response-percent/audit.jsonl",
      "role": "audit",
      "sha256": "96f627cda36b99f17be7e4bd8b17177661c84e6f0cd75fcf9d62f09f1f096388",
      "size_bytes": 2600133
    },
    {
      "path": "datasets/model-ready/flow-catechol-product-2-response-percent/checksums.csv",
      "role": "checksums",
      "sha256": "9da5416071cd7d2335dafc4ba4bee8b811989ccdf2e644b15f258f703451a59b",
      "size_bytes": 809
    }
  ],
  "corpus_row_count": 1227,
  "dataset_kind": "model-ready",
  "dataset_slug": "flow-catechol-product-2-response-percent",
  "display_name_en": "Flow Catechol Product 2 HPLC Response (%)",
  "display_name_zh": "连续流儿茶酚产物 2 HPLC 响应（%）",
  "excluded_count": 0,
  "included_count": 1227,
  "input_provenance": {
    "ord_upstream_revision": "83f971f586f6ad18f358ae4ae99d045e94ed2066",
    "pipeline_commit": null,
    "provenance_schema_version": "1.0.0",
    "semantic_name_policy_version": "semantic-target-names-v1",
    "source_manifest_sha256": "2daa4f0737333cec1a699f3c2f4b977d19db67aa06a0ef95749ec846e0ac72f7"
  },
  "label": {
    "column": "product_2_yield_percent",
    "policy": "catechol_multitarget_v1:smiles_custom_name_hplc_yield",
    "type": "hplc_response_percent",
    "unit": "HPLC percentage response; not isolated yield"
  },
  "license_id": "CC-BY-SA-4.0",
  "logical_dataset_id": "physical_1ec2807f02fa4beda27d2a81b86eb843",
  "physical_dataset_ids": [
    "ord_dataset-1ec2807f02fa4beda27d2a81b86eb843"
  ],
  "readiness_status": "research_only_benchmark_blocked",
  "schema_version": "1.0.0",
  "source_links_path": "datasets/model-ready/flow-catechol-product-2-response-percent/source-links.json",
  "target_id": "catechol_product_2_yield_percent"
}
