{
  "artifact_status": "staged",
  "content_artifacts": [
    {
      "path": "datasets/model-ready/photocatalytic-aryl-bromide-dehalogenation-conversion-percent/photocatalytic-aryl-bromide-dehalogenation-conversion-percent-dataset.csv",
      "role": "dataset",
      "sha256": "427e149d84943bb82adcf3066be751edd2418696bb8b972177e510663a1a2ef3",
      "size_bytes": 238260
    },
    {
      "path": "datasets/model-ready/photocatalytic-aryl-bromide-dehalogenation-conversion-percent/schema.json",
      "role": "schema",
      "sha256": "701e39c8d386813caa498b191451173872a77eca2b8aa7d962a8aeb667593323",
      "size_bytes": 1674
    },
    {
      "path": "datasets/model-ready/photocatalytic-aryl-bromide-dehalogenation-conversion-percent/exclusions.csv",
      "role": "exclusions",
      "sha256": "4db87054e05506fd5de5d774c6c8838094902ffa774d224d92780299eeee63a7",
      "size_bytes": 85
    },
    {
      "path": "datasets/model-ready/photocatalytic-aryl-bromide-dehalogenation-conversion-percent/row-map.csv",
      "role": "row-map",
      "sha256": "e1c91bfc396d85a7b2fda5f219366b114cdb24908922758445734504ef8bfc0b",
      "size_bytes": 230573
    },
    {
      "path": "datasets/model-ready/photocatalytic-aryl-bromide-dehalogenation-conversion-percent/audit.jsonl",
      "role": "audit",
      "sha256": "111bbbe137bb48cf53fbacfddbc33b1a4545adaedd9ff7574cbcceb5a3afdad1",
      "size_bytes": 1012332
    },
    {
      "path": "datasets/model-ready/photocatalytic-aryl-bromide-dehalogenation-conversion-percent/checksums.csv",
      "role": "checksums",
      "sha256": "37a88a7be9f0209f0308641456570a20d63598e600a838ba6f441cea52218c1e",
      "size_bytes": 770
    }
  ],
  "corpus_row_count": 1152,
  "dataset_kind": "model-ready",
  "dataset_slug": "photocatalytic-aryl-bromide-dehalogenation-conversion-percent",
  "display_name_en": "Photocatalytic Aryl-Bromide Dehalogenation Conversion (%)",
  "display_name_zh": "光催化芳基溴脱卤转化率（%）",
  "excluded_count": 0,
  "included_count": 1152,
  "input_provenance": {
    "ord_upstream_revision": "83f971f586f6ad18f358ae4ae99d045e94ed2066",
    "pipeline_commit": null,
    "provenance_schema_version": "1.0.0",
    "semantic_name_policy_version": "semantic-target-names-v1",
    "source_manifest_sha256": "2daa4f0737333cec1a699f3c2f4b977d19db67aa06a0ef95749ec846e0ac72f7"
  },
  "label": {
    "column": "conversion_percent",
    "policy": "unique_structured_scalar_no_aggregation",
    "type": "conversion_percent",
    "unit": "percent conversion"
  },
  "license_id": "CC-BY-SA-4.0",
  "logical_dataset_id": "physical_b440f8c90b6343189093770060fc4098",
  "physical_dataset_ids": [
    "ord_dataset-b440f8c90b6343189093770060fc4098"
  ],
  "readiness_status": "active_generated_pending_release_validation",
  "schema_version": "1.0.0",
  "source_links_path": "datasets/model-ready/photocatalytic-aryl-bromide-dehalogenation-conversion-percent/source-links.json",
  "target_id": "photodehalogenation_conversion_percent"
}
