{
  "artifact_status": "staged",
  "content_artifacts": [
    {
      "path": "datasets/model-ready/chemrxiv-imidazole-c-h-arylation-yield-percent/chemrxiv-imidazole-c-h-arylation-yield-percent-dataset.csv",
      "role": "dataset",
      "sha256": "3d11901429869a5875d98ec4feec8239efbfa121c59d750a9bf8c04612906f7d",
      "size_bytes": 394075
    },
    {
      "path": "datasets/model-ready/chemrxiv-imidazole-c-h-arylation-yield-percent/schema.json",
      "role": "schema",
      "sha256": "a27995892bdb21300f96b92705aa7807e6908c32e65dce289fc0d5791cb781b7",
      "size_bytes": 1810
    },
    {
      "path": "datasets/model-ready/chemrxiv-imidazole-c-h-arylation-yield-percent/yonod-config.json",
      "role": "yonod-config",
      "sha256": "fe20a135bbf43e59124b195d58b74780ec6797cbce732393f8338b0777337cad",
      "size_bytes": 3483
    },
    {
      "path": "datasets/model-ready/chemrxiv-imidazole-c-h-arylation-yield-percent/exclusions.csv",
      "role": "exclusions",
      "sha256": "8f47e75aea68776f95629257185ead1b25f8088098e25f2aa75b73edd8ec4db6",
      "size_bytes": 1142
    },
    {
      "path": "datasets/model-ready/chemrxiv-imidazole-c-h-arylation-yield-percent/row-map.csv",
      "role": "row-map",
      "sha256": "834e743133299f6acac97bd37d9a34ccca5e3ef92fa96e062a31e12c9a12870f",
      "size_bytes": 306734
    },
    {
      "path": "datasets/model-ready/chemrxiv-imidazole-c-h-arylation-yield-percent/audit.jsonl",
      "role": "audit",
      "sha256": "45ef40a04b51b0c0b4c55f66e72de3b66852eabb0044c69359f8b52bdbe1b0a6",
      "size_bytes": 1465133
    },
    {
      "path": "datasets/model-ready/chemrxiv-imidazole-c-h-arylation-yield-percent/checksums.csv",
      "role": "checksums",
      "sha256": "21d6bfcaf121677f53fb4030f758accbd948f4e0479864c9e8a0b9af9ea960fd",
      "size_bytes": 858
    }
  ],
  "corpus_row_count": 2496,
  "dataset_kind": "model-ready",
  "dataset_slug": "chemrxiv-imidazole-c-h-arylation-yield-percent",
  "display_name_en": "ChemRxiv Imidazole C-H Arylation Yield (%)",
  "display_name_zh": "ChemRxiv 咪唑 C-H 芳基化产率（%）",
  "excluded_count": 7,
  "included_count": 1529,
  "input_provenance": {
    "ord_upstream_revision": "83f971f586f6ad18f358ae4ae99d045e94ed2066",
    "pipeline_commit": null,
    "provenance_schema_version": "1.0.0",
    "semantic_name_policy_version": "semantic-target-names-v1",
    "source_manifest_sha256": "2daa4f0737333cec1a699f3c2f4b977d19db67aa06a0ef95749ec846e0ac72f7"
  },
  "label": {
    "column": "yield_percent",
    "policy": "unique_structured_scalar_no_aggregation",
    "type": "reaction_yield_percent",
    "unit": "percent yield as defined by the source measurement"
  },
  "license_id": "CC-BY-SA-4.0",
  "logical_dataset_id": "upstream_chemrxiv_64c7e2e1658ec5f7e5808425",
  "physical_dataset_ids": [
    "ord_dataset-675eddcaa6674ce3ae61e79bbc1e1c08"
  ],
  "readiness_status": "active_generated_pending_release_validation",
  "schema_version": "1.0.0",
  "source_links_path": "datasets/model-ready/chemrxiv-imidazole-c-h-arylation-yield-percent/source-links.json",
  "target_id": "chemrxiv_ch_arylation_yield_percent"
}
