{
  "artifact_status": "staged",
  "content_artifacts": [
    {
      "path": "datasets/model-ready/nicolit-nickel-coupling-yield-percent/nicolit-nickel-coupling-yield-percent-dataset.csv",
      "role": "dataset",
      "sha256": "51f705bdfc42ff0432cdb6288cda3ee9cbd6e2294c216fff13e5015e94b3deda",
      "size_bytes": 160767
    },
    {
      "path": "datasets/model-ready/nicolit-nickel-coupling-yield-percent/schema.json",
      "role": "schema",
      "sha256": "638b58bff19c3c9f9def449ad88282b8d098f67875af61b8fbc51fb193b63b5b",
      "size_bytes": 1470
    },
    {
      "path": "datasets/model-ready/nicolit-nickel-coupling-yield-percent/exclusions.csv",
      "role": "exclusions",
      "sha256": "0476f714c7b4f83f797f954722bd7dfbf0c02ca8deb4c4e358abcd1ac4b116ff",
      "size_bytes": 20593
    },
    {
      "path": "datasets/model-ready/nicolit-nickel-coupling-yield-percent/row-map.csv",
      "role": "row-map",
      "sha256": "acc6d7300beb9464bdc0ae3d9c5cdf8acf885588fca51460a036bfdef0351f03",
      "size_bytes": 335061
    },
    {
      "path": "datasets/model-ready/nicolit-nickel-coupling-yield-percent/audit.jsonl",
      "role": "audit",
      "sha256": "59f4a0c49a1a55400330b1bb372247098d02749e7c6a9155c9e4fab13ed44a6c",
      "size_bytes": 3856916
    },
    {
      "path": "datasets/model-ready/nicolit-nickel-coupling-yield-percent/checksums.csv",
      "role": "checksums",
      "sha256": "c3521b5194cf8fc0421434ac0dabfc32eae76edbebe3ad6774a24543a5f62de3",
      "size_bytes": 749
    }
  ],
  "corpus_row_count": 1762,
  "dataset_kind": "model-ready",
  "dataset_slug": "nicolit-nickel-coupling-yield-percent",
  "display_name_en": "NiCOlit Nickel-Coupling Yield (%)",
  "display_name_zh": "NiCOlit 镍催化偶联产率（%）",
  "excluded_count": 93,
  "included_count": 1669,
  "input_provenance": {
    "ord_upstream_revision": "83f971f586f6ad18f358ae4ae99d045e94ed2066",
    "pipeline_commit": null,
    "provenance_schema_version": "1.0.0",
    "semantic_name_policy_version": "semantic-target-names-v1",
    "source_manifest_sha256": "2daa4f0737333cec1a699f3c2f4b977d19db67aa06a0ef95749ec846e0ac72f7"
  },
  "label": {
    "column": "yield_percent",
    "policy": "unique_structured_scalar_no_aggregation",
    "type": "reaction_yield_percent",
    "unit": "percent yield as defined by the source measurement"
  },
  "license_id": "CC-BY-SA-4.0",
  "logical_dataset_id": "physical_9b8aa9a7835143ef8ce3f70abfab7545",
  "physical_dataset_ids": [
    "ord_dataset-9b8aa9a7835143ef8ce3f70abfab7545"
  ],
  "readiness_status": "generated_with_source_caveat",
  "schema_version": "1.0.0",
  "source_links_path": "datasets/model-ready/nicolit-nickel-coupling-yield-percent/source-links.json",
  "target_id": "nicolit_yield_percent"
}
