{
  "artifact_status": "staged",
  "content_artifacts": [
    {
      "path": "datasets/model-ready/ahneman-c-n-cross-coupling-yield-percent/ahneman-c-n-cross-coupling-yield-percent-dataset.csv",
      "role": "dataset",
      "sha256": "6a912585bb987ab698e2502585e1927403c372e10d8e3bcf8ce26f93c4021acf",
      "size_bytes": 1271230
    },
    {
      "path": "datasets/model-ready/ahneman-c-n-cross-coupling-yield-percent/schema.json",
      "role": "schema",
      "sha256": "480b2573e565f5fc493a7d4dfb2bbd72e774309a39703f04cafaabf40cd6c943",
      "size_bytes": 1722
    },
    {
      "path": "datasets/model-ready/ahneman-c-n-cross-coupling-yield-percent/exclusions.csv",
      "role": "exclusions",
      "sha256": "4db87054e05506fd5de5d774c6c8838094902ffa774d224d92780299eeee63a7",
      "size_bytes": 85
    },
    {
      "path": "datasets/model-ready/ahneman-c-n-cross-coupling-yield-percent/row-map.csv",
      "role": "row-map",
      "sha256": "a1cecd6b5d68702d2153c35c0d6c184f8a72f7b73b486bbc48cc1b07c15e9504",
      "size_bytes": 868893
    },
    {
      "path": "datasets/model-ready/ahneman-c-n-cross-coupling-yield-percent/audit.jsonl",
      "role": "audit",
      "sha256": "51a45a5858b8b5ea0f068388fd2d7af3ace39f76f685e0f10054e368dfb87215",
      "size_bytes": 3922370
    },
    {
      "path": "datasets/model-ready/ahneman-c-n-cross-coupling-yield-percent/checksums.csv",
      "role": "checksums",
      "sha256": "ebbb8ac411d10534e5c16b9579756fad3bd8795d130d144944cb055a88d00f8b",
      "size_bytes": 750
    }
  ],
  "corpus_row_count": 4312,
  "dataset_kind": "model-ready",
  "dataset_slug": "ahneman-c-n-cross-coupling-yield-percent",
  "display_name_en": "Ahneman C-N Cross-Coupling Yield (%)",
  "display_name_zh": "Ahneman C-N 交叉偶联产率（%）",
  "excluded_count": 0,
  "included_count": 4312,
  "input_provenance": {
    "ord_upstream_revision": "83f971f586f6ad18f358ae4ae99d045e94ed2066",
    "pipeline_commit": null,
    "provenance_schema_version": "1.0.0",
    "semantic_name_policy_version": "semantic-target-names-v1",
    "source_manifest_sha256": "2daa4f0737333cec1a699f3c2f4b977d19db67aa06a0ef95749ec846e0ac72f7"
  },
  "label": {
    "column": "yield_percent",
    "policy": "unique_structured_scalar_no_aggregation",
    "type": "reaction_yield_percent",
    "unit": "percent yield as defined by the source measurement"
  },
  "license_id": "CC-BY-SA-4.0",
  "logical_dataset_id": "physical_46ff9a32d9e04016b9380b1b1ef949c3",
  "physical_dataset_ids": [
    "ord_dataset-46ff9a32d9e04016b9380b1b1ef949c3"
  ],
  "readiness_status": "active_generated_pending_release_validation",
  "schema_version": "1.0.0",
  "source_links_path": "datasets/model-ready/ahneman-c-n-cross-coupling-yield-percent/source-links.json",
  "target_id": "ahneman_yield_percent"
}
